{
  "capability_id": "motion.move_to_pose",
  "status": "TIMEOUT",
  "command_accepted": true,
  "command_executed": true,
  "planned_only": false,
  "controller_target_reached": false,
  "effect_observed": null,
  "goal_verified": false,
  "verification": null,
  "outputs": {},
  "errors": [],
  "warnings": [],
  "metrics": {},
  "artifacts": {},
  "started_at": "2026-01-01T00:00:00+00:00",
  "ended_at": "2026-01-01T00:00:01+00:00"
}
