{
  "capability_id": "motion.move_to_pose",
  "status": "DENIED",
  "command_accepted": false,
  "command_executed": false,
  "planned_only": false,
  "controller_target_reached": null,
  "effect_observed": null,
  "goal_verified": false,
  "verification": null,
  "outputs": {},
  "errors": [],
  "warnings": [],
  "metrics": {},
  "artifacts": {},
  "started_at": "2026-01-01T00:00:00+00:00",
  "ended_at": null
}
